{
  "$schema": "http://json-schema.org/draft-07/schema#",
  "type": "object",
  "properties": {
    "case_id": {
      "type": "string"
    },
    "program": {
      "type": "string"
    },
    "program_rules": {
      "type": "array",
      "items": {
        "type": "string"
      }
    },
    "household": {
      "type": "array",
      "items": {
        "type": "string"
      }
    },
    "internal_notes": {
      "type": "string"
    }
  },
  "required": [
    "case_id",
    "program",
    "program_rules",
    "household"
  ]
}